{
  "schema_version": "1.0",
  "citation_id": "cite_synthetic_method",
  "claim_id": "clm_method_choice",
  "source_id": "src_synthetic_method",
  "usage": "method",
  "locator": {
    "kind": "paragraph",
    "value": "Synthetic repository, methodology paragraph 2"
  },
  "support_boundary": "Supports the rationale for selecting the synthetic methodology only",
  "verified_at": "2026-08-21T09:30:00+08:00"
}
